WOS:000415969300004,"Haas, IJ; Baker, MN; Gonzalez, FJ",Who Can Deviate from the Party Line? Political Ideology Moderates Evaluation of Incongruent Policy Positions in Insula and Anterior Cingulate Cortex,2017,10.1007/s11211-017-0295-0,1,0,58,bottom,0,"Political polarization at the elite level is a major concern in many contemporary democracies, which is argued to alienate large swaths of the electorate and prevent meaningful social change from occurring, yet little is known about how individuals respond to political candidates who deviate from the party line and express policy positions incongruent with their party affiliations. This experiment examines the neural underpinnings of such evaluations using functional MRI (fMRI). During fMRI, participants completed an experimental task where they evaluated policy positions attributed to hypothetical political candidates. Each block of trials focused on one candidate (Democrat or Republican), but all participants saw two candidates from each party in a randomized order. On each trial, participants received information about whether the candidate supported or opposed a specific policy issue. These issue positions varied in terms of congruence between issue position and candidate party affiliation. We modeled neural activity as a function of incongruence and whether participants were viewing ingroup or outgroup party candidates. Results suggest that neural activity in brain regions previously implicated in both evaluative processing and work on ideological differences (insula and anterior cingulate cortex) differed as a function of the interaction between incongruence, candidate type (ingroup versus outgroup), and political ideology. More liberal participants showed greater activation to incongruent versus congruent trials in insula and ACC, primarily when viewing ingroup candidates. Implications for the study of democratic representation and linkages between citizens' calls for social change and policy implementation are discussed.",SOCIAL JUSTICE RESEARCH
WOS:000441538200026,"Duarte, IC; Brito-Costa, S; Cayolla, R; Castelo-Branco, M",The role of Prefrontal Cortex in a Battle of the Sexes Dilemma involving a Conflict between Tribal and Romantic love,2018,10.1038/s41598-018-30611-6,1,0,44,bottom,0,"The neural basis of dilemmas involving decisions with profound affective impact, such as in romantic life, remains to be understood. The ""Battle of the Sexes"" is a paradigm from Game Theory that can be used to experimentally address such dilemmas. A form of in-group love, tribal love in football fans, provides the opportunity to study strong affective dilemmas when tribal and romantic love compete for hedonic decision-making. Here, we used for the first time a ""Battle of the Sexes"" dilemma using fMRI. We investigated, in 44 male football fans, the neural correlates of cooperative behaviour under conflicting choices in the context of romantic versus tribal love. We identified a critical functional segregation of prefrontal regions in affective decision-making. The orbitofronta I cortex signalled emotional appraisal of the dilemma. The medial anterolateral and the ventromedial prefrontal cortices reflected reciprocal cooperation instead of selfish engagement in football-related activities. The lateral portion of anterolateral prefrontal cortex was recruited during ultimate deliberation. In sum, emotional appraisal and rational choice reflected a contiguous functional parcellation in anterolateral prefrontal cortex: appraisal (medial) vs. choice (lateral region).",SCIENTIFIC REPORTS
WOS:000446054000002,"Dien, J; Karuzis, V; Haarmann, HJ",Probing culture in the head: the neural correlates of relational models,2018,10.1080/17470919.2018.1459313,1,0,39,bottom,0,"Relational Models Theory or RMT proposes that there are four universal ways in which socio-economic relations can be organized. According to the RMT, each of its four relational models (Communal Sharing, Authority Ranking, Equality Matching, and Market Pricing) is associated with a distinct cognitive representation, with a cumulative pattern in which each relational model is a superset of the next lower model. This report for the first time uses a combination of cognitive and the social neuroscience to put this model to the test.RMT proposes that members of every culture use all four relational models, just in different proportions. It should therefore be possible to study their neural correlates in a mono-cultural sample. In this study, thirty-nine European-American students were imaged in a 3T Siemens Trio with a 24-channel head coil while rating the extent to which each relational model organized relationships with each of thirty-two acquaintances/friend/relatives in a boxcar design. FreeSurfer Functional Analysis Stream (FS-FAST) analyses revealed distinct patterns of activation for each of the relational models. The activations did not follow a cumulative hierarchical pattern, suggestive that this aspect of the RMT model should be revised.",SOCIAL NEUROSCIENCE
WOS:000445330400005,"Javor, A; Kindermann, H; Koschutnig, K; Ischebeck, A",The neural correlates of trustworthiness evaluations of faces and brands: Implications for behavioral and consumer neuroscience,2018,10.1111/ejn.14134,1,0,37,bottom,0,"When we buy a product of a brand, we trust the brand to provide good quality and reliability. Therefore, trust plays a major role in consumer behavior. It is unclear, however, how trust in brands is processed in the brain and whether it is processed differently from interpersonal trust. In this study, we used fMRI to investigate the neural correlates of interpersonal and brand trust by comparing the brain activation patterns during explicit trustworthiness judgments of faces and brands. Our results showed that while there were several brain areas known to be linked to trustworthiness evaluations, such as the amygdalae, more active in trustworthiness judgments when compared to a control task (familiarity judgment) for faces, no such difference was found for brands. Complementary ROI analysis revealed that the activation of both amygdalae was strongest for faces in the trustworthiness judgments. The direct comparison of the brain activation patterns during the trustworthiness evaluations between faces and brands in this analysis showed that trustworthiness judgments of faces activated the orbitofrontal cortex, another region that was previously linked to interpersonal trust, more strongly than trustworthiness judgments of brands. Further, trustworthiness ratings of faces, but not brands, correlated with activation in the orbitofrontal cortex. Our results indicate that the amygdalae, as well as the orbitofrontal cortex, play a prominent role in interpersonal trust (faces), but not in trust for brands. It is possible that this difference is due to brands being processed as cultural objects rather than as having human-like personality characteristics.",EUROPEAN JOURNAL OF NEUROSCIENCE
WOS:000401868900001,"Reyes-Aguilar, A; Fernandez-Ruiz, J; Pasaye, EH; Barrios, FA",Executive Mechanisms for Thinking about Negative Situations in Both Cooperative and Non-Cooperative Contexts,2017,10.3389/fnhum.2017.00275,1,0,34,bottom,0,"Mentalizing is a fundamental aspect of social cognition that includes understanding the mental states of others. This process involves the participation of a well-defined set of brain regions. However, it is still unknown how different contextual situations, such as previous cooperative or non-cooperative interactions, can modulate the brain activity related to the inference of others' mental states. Hence, this study investigated whether a previous social interaction can modulate the neural mechanisms involved in a way to response to inferred mental states of cooperators and non-cooperators in positive vs. negative emotional situations. Participants first engaged in a Dictator game with cooperator and non-cooperator confederates. Then, in an fMRI setup, participants had to infer the mental states of the cooperator and non-cooperator confederates under positive and negative situations. Results showed that in addition to the mentalizing network, inferring mental states recruited occipital and cerebellar areas in the cooperative context. A differential pattern of activity that depended on the emotional valence of the situation was also detected, i.e., negative situations recruited prefrontal cortex (PFC) in both contexts, while temporal regions were recruited only for the non-cooperative context. Overall, these results suggest that our previous experiences with others modulate the brain activity related to the inferences we make about their mental states in specific emotional situations.",FRONTIERS IN HUMAN NEUROSCIENCE
WOS:000449374000029,"Resibois, M; Rotge, JY; Delaveau, P; Kuppens, P; Van Mechelen, I; Fossati, P; Verduyn, P",The impact of self-distancing on emotion explosiveness and accumulation: An fMRI study,2018,10.1371/journal.pone.0206889,1,0,32,bottom,0,"Emotions unfold over time with episodes differing in explosiveness (i.e., profiles having a steep vs. a gentle start) and accumulation (i.e., profiles increasing over time vs. going back to baseline). In the present fMRI study, we wanted to replicate and extend previous findings on the psychological and neural mechanisms underlying emotion explosiveness and accumulation. Specifically, we aimed to: (a) replicate the finding that different neural mechanisms are associated with emotion explosiveness and accumulation, (b) replicate the finding that adopting a self-distanced (vs. self-immersed) perspective decreases emotion explosiveness and accumulation at the level of self-report, and (c) examine whether adopting a self-distanced (vs. self-immersed) perspective similarly modulates activity in the brain regions associated with emotion explosiveness and accumulation. Participants in an fMRI scanner were asked to adopt a self-immersed or self-distanced perspective while reading and thinking about negative social feedback, and to report on felt changes in negative affect during that period using an emotion intensity profile tracking approach. We replicated previous findings showing that emotion explosiveness and accumulation were related to activity in regions involved in self-referential processing (such as the medial prefrontal cortex) and sustained visceral arousal (such as the posterior insula), respectively. The finding that adopting a self-distanced (vs. self-immersed) perspective lowers emotion explosiveness and accumulation was also replicated at a self-report level. However, perspective taking did not impact activity in the neural correlates of emotion explosiveness and accumulation.",PLOS ONE
WOS:000370371700001,"Tanaka, SC; Yamada, K; Kitada, R; Tanaka, S; Sugawara, SK; Ohtake, F; Sadato, N","Overstatement in happiness reporting with ordinal, bounded scale",2016,10.1038/srep21321,1,0,30,bottom,0,"There are various methods by which people can express subjective evaluations quantitatively. For example, happiness can be measured on a scale from 1 to 10, and has been suggested as a measure of economic policy. However, there is resistance to these types of measurement from economists, who often regard welfare to be a cardinal, unbounded quantity. It is unclear whether there are differences between subjective evaluation reported on ordinal, bounded scales and on cardinal, unbounded scales. To answer this question, we developed functional magnetic resonance imaging experimental tasks for reporting happiness from monetary gain and the perception of visual stimulus. Subjects tended to report higher values when they used ordinal scales instead of cardinal scales. There were differences in neural activation between ordinal and cardinal reporting scales. The posterior parietal area showed greater activation when subjects used an ordinal scale instead of a cardinal scale. Importantly, the striatum exhibited greater activation when asked to report happiness on an ordinal scale than when asked to report on a cardinal scale. The finding that ordinal (bounded) scales are associated with higher reported happiness and greater activation in the reward system shows that overstatement bias in happiness data must be considered.",SCIENTIFIC REPORTS
WOS:000414073100003,"Carey, D; Miquel, ME; Evans, BG; Adank, P; McGettigan, C",Functional brain outcomes of L2 speech learning emerge during sensorimotor transformation,2017,10.1016/j.neuroimage.2017.06.053,1,0,28,bottom,0,"Sensorimotor transformation (ST) may be a critical process in mapping perceived speech input onto non-native (L2) phonemes, in support of subsequent speech production. Yet, little is known concerning the role of ST with respect to L2 speech, particularly where learned L2 phones (e.g., vowels) must be produced in more complex lexical contexts (e.g., multi-syllabic words). Here, we charted the behavioral and neural outcomes of producing trained L2 vowels at word level, using a speech imitation paradigm and functional MRI. We asked whether participants would be able to faithfully imitate trained L2 vowels when they occurred in non-words of varying complexity (one or three syllables). Moreover, we related individual differences in imitation success during training to BOLD activation during ST (i.e., pre-imitation listening), and during later imitation. We predicted that superior temporal and peri-Sylvian speech regions would show increased activation as a function of item complexity and non-nativeness of vowels, during ST. We further anticipated that pre-scan acoustic learning performance would predict BOLD activation for non-native (vs. native) speech during ST and imitation. We found individual differences in imitation success for training on the non-native vowel tokens in isolation; these were preserved in a subsequent task, during imitation of mono-and trisyllabic words containing those vowels. fMRI data revealed a widespread network involved in ST, modulated by both vowel nativeness and utterance complexity: superior temporal activation increased monotonically with complexity, showing greater activation for non-native than native vowels when presented in isolation and in trisyllables, but not in monosyllables. Individual differences analyses showed that learning versus lack of improvement on the non-native vowel during pre-scan training predicted increased ST activation for non-native compared with native items, at insular cortex, pre-SMA/SMA, and cerebellum. Our results hold implications for the importance of ST as a process underlying successful imitation of non-native speech.",NEUROIMAGE
WOS:000369415600001,"Suzuki, A; Ito, Y; Kiyama, S; Kunimi, M; Ohira, H; Kawaguchi, J; Tanabe, HC; Nakai, T",Involvement of the Ventrolateral Prefrontal Cortex in Learning Others' Bad Reputations and Indelible Distrust,2016,10.3389/fnhum.2016.00028,1,0,28,bottom,0,"A bad reputation can persistently affect judgments of an individual even when it turns out to be invalid and ought to be disregarded. Such indelible distrust may reflect that the negative evaluation elicited by a bad reputation transfers to a person. Consequently, the person him/herself may come to activate this negative evaluation irrespective of the accuracy of the reputation. If this theoretical model is correct, an evaluation-related brain region will be activated when witnessing a person whose bad reputation one has learned about, regardless of whether the reputation is deemed valid or not. Here, we tested this neural hypothesis with functional magnetic resonance imaging (fMRI). Participants memorized faces paired with either a good or a bad reputation. Next, they viewed the faces alone and inferred whether each person was likely to cooperate, first while retrieving the reputations, and then while trying to disregard them as false. A region of the left ventrolateral prefrontal cortex (vIPFC), which may be involved in negative evaluation, was activated by faces previously paired with bad reputations, irrespective of whether participants attempted to retrieve or disregard these reputations. Furthermore, participants showing greater activity of the left ventrolateral prefrontal region in response to the faces with bad reputations were more likely to infer that these individuals would not cooperate. Thus, once associated with a bad reputation, a person may elicit evaluation related brain responses on their own, thereby evoking distrust independently of their reputation.",FRONTIERS IN HUMAN NEUROSCIENCE
WOS:000384074500029,"Gilead, M; Liberman, N; Maril, A","The effects of an action's \age-of-acquisition\"" on action-sentence processing""",2016,10.1016/j.neuroimage.2016.07.034,1,0,27,bottom,0,"How does our brain allow us comprehend abstract/symbolic descriptions of human action? Whereas past research suggested that processing action language relies on sensorimotor brain regions, recent work suggests that sensorimotor activation depends on participants' task goals, such that focusing on abstract (vs. concrete) aspects of an action activates ""default mode network"" (rather than sensorimotor) regions. Following a Piagetian framework, we hypothesized that for actions acquired at an age wherein abstract/symbolic cognition is fully-developed, even when participants focus on the concrete aspects of an action, they should retrieve abstract-symbolic mental representations. In two studies, participants processed the concrete (i.e., ""how"") and abstract (i.e., ""why"") aspects of late-acquired and early-acquired actions. Consistent with previous research, focusing on the abstract (vs. concrete) aspects of an action resulted in greater activation in the ""defaultmode network"". Importantly, the activation in these regions was higher when processing later-acquired (vs. earlier acquired) actions-also when participants' goal was to focus on the concrete aspects of the action. We discuss the implications of the current findings to research on the involvement of concrete representations in abstract cognition. (C) 2016 Elsevier Inc. All rights reserved.",NEUROIMAGE
WOS:000404656000005,"Lee, TW; Xue, SW",Examination of the validity of the atlas-informed approach to functional parcellation: a resting functional MRI study,2017,10.1097/WNR.0000000000000808,1,0,26,bottom,0,"With the advancement in MRI, functional parcellation (FP) of brain structure(s) has become an important topic. However, the large number of voxels is a major obstacle. A-priori partitioning of the brain into several regions of interest (ROIs) is the main data-reduction strategy to simplify brain informatics. This study aims to examine the validity of ROI-based approach to FP by exploring the concordance of the relative distance structures between voxel-wise (raw data) and atlas-informed analyses. Structural and resting state functional MRI (rfMRI) scans of 26 right-handed healthy individuals were selected from the Rockland dataset. Four target regions were included in the analyses, that is, left and right thalamus and amygdala. For each voxel in the target region, four classes of correlation maps (sampling strategies) were constructed from the rfMRI: whole brain, cortex, 150 ROIs, and 70 ROIs (ROIs are informed by anatomical atlases). The relative distance metric between two different voxels was defined as the mean absolute difference of their associated correlation maps. Considering all the possible pairs of voxels in a target region, the relative distance structure was derived and stored in a matrix distance map). For every target region, the distance maps were very similar across the four classes of sampling strategies, with the grand mean correlation coefficient reaching 0.95. The results confirm the validity of previous ROI-based analyses of rfMRI data in FP. The rationale and limitation are discussed and an analytic strategy of whole-brain FP is proposed. Copyright (C) 2017 Wolters Kluwer Health, Inc. All rights reserved.",NEUROREPORT
WOS:000381447400001,"Van der Cruyssen, L; Ozdem, C; Haesevoets, T; Vandekerckhove, M; Van Overwalle, F",Athlete or athletic? Limited differential brain activation in person descriptions using nouns or adjectives,2016,10.1016/j.bandl.2016.04.012,1,0,25,bottom,0,"Do differences between the syntactic categories of nouns and adjectives for describing persons translate into different patterns of brain activation? In this fMRI study, we compared reading person and object descriptions denoted by nouns or adjectives. Previous behavioral studies found that nouns, describing the more abstract construct of social categories, compared to adjectives, describing the more concrete construct of personality traits, have an impact on the inferences made about a person. Additionally, previous neuroimaging findings suggest that abstract constructs recruit a different pattern of brain activation, compared to more concrete constructs. Participants read sentences describing a protagonist by means of a noun or an adjective, as well as sentences describing objects through a noun or an adjective. The results revealed that reading nouns as opposed to adjectives showed increased activation in the left lingual gyrus for persons, and additionally in the right lingual gyrus for objects. The results indicate that there are limited differences in the processing of nouns and adjectives when describing persons. (C) 2016 Elsevier Inc. All rights reserved.",BRAIN AND LANGUAGE
WOS:000356901900019,"Appelgren, A; Bengtsson, SL",Feedback on Trait or Action Impacts on Caudate and Paracingulum Activity,2015,10.1371/journal.pone.0129714,1,0,20,bottom,0,"There is a general conception that positive associations to one's trait, e.g. 'I'm clever', are beneficial for cognitive performance. Scientific evidence shows that this is a simplification. In this functional magnetic resonance imaging (fMRI) study we used written trial-based trait feedback 'you are clever', or task feedback 'your choice was correct', on each correct response of a rule-switching task, to investigate how the character of positive self-associations influences performance outcome. Twenty participants took part in this crossover design study. We found that trait feedback was less beneficial for motivation and performance improvement, and resulting in enhanced neural activation on more difficult bivalent rule trials. This indicates that the task was treated as more complex in this condition. For example, 'you are clever' feedback led to enhanced activation in anterior caudate nucleus, an area known to process uncertainty. We further observed that activation in anterior paracingulate cortex was sensitive to whether self-reflection was imposed by external feedback or generated from internal processes, where the latter activation correlated positively with performance when following after task feedback. Our results illustrate how feedback can evoke self-reflections that either help or hinder motivation and performance, most likely by impacting on processes of uncertainty. The results support social psychological models stipulating that trait focus take resources away from task focus.",PLOS ONE
WOS:000404691800007,"Sosnowski, T; Rynkiewicz, A; Wordecha, M; Kwkowicz, A; Majewska, A; Pstragowska, A; Oleksy, T; Wypych, M; Marchewka, A",Patterns of brain and cardiovascular activation while solving rule-discovery and rule-application numeric tasks,2017,10.1016/j.ijpsycho.2017.04.006,1,0,18,bottom,0,"It is known that solving mental tasks leads to tonic increase in cardiovascular activity. Our previous research showed that tasks involving rule application (RA) caused greater tonic increase in cardiovascular activity than tasks requiring rule discovery (RD). However, it is not clear what brain mechanisms are responsible for this difference. The aim of two experimental studies was to compare the patterns of brain and cardiovascular activity while both RD and the RA numeric tasks were being solved. The fMRI study revealed greater brain activation while solving RD tasks than while solving RA tasks. In particular, RD tasks evoked greater activation of the left inferior frontal gyrus and selected areas in the parietal, and temporal cortices, including the precuneus, supramarginal gyrus, angular gyrus, inferior parietal lobule, and the superior temporal gyrus, and the cingulate cortex. In addition, RA tasks caused larger increases in HR than RD tasks. The second study, carried out in a cardiovascular laboratory, showed greater increases in heart rate (HR), systolic blood pressure (SBP), diastolic blood pressure (DBP), and mean arterial pressure (MAP) while solving RA tasks than while solving RD tasks. The results support the hypothesis that RD and RA tasks involve different modes of information processing, but the neuronal mechanism responsible for the observed greater cardiovascular response to RA tasks than to RD tasks is not completely clear.",INTERNATIONAL JOURNAL OF PSYCHOPHYSIOLOGY
