WOS:000360949300002,"Quadflieg, S; Gentile, F; Rossion, B",The neural basis of perceiving person interactions,2015,10.1016/j.cortex.2014.12.020,1,22,12,middle,0.305555556,"This study examined whether the grouping of people into meaningful social scenes (e.g., two people having a chat) impacts the basic perceptual analysis of each partaking individual. To explore this issue, we measured neural activity using functional magnetic resonance imaging (fMRI) while participants sex-categorized congruent as well as incongruent person dyads (i.e., two people interacting in a plausible or implausible manner). Incongruent person dyads elicited enhanced neural processing in several high-level visual areas dedicated to face and body encoding and in the posterior middle temporal gyrus compared to congruent person dyads. Incongruent and congruent person scenes were also successfully differentiated by a linear multivariate pattern classifier in the right fusiform body area and the left extrastriate body area. Finally, increases in the person scenes' meaningfulness as judged by independent observers was accompanied by enhanced activity in the bilateral posterior insula. These findings demonstrate that the processing of person scenes goes beyond a mere stimulus-bound encoding of their partaking agents, suggesting that changes in relations between agents affect their representation in category-selective regions of the visual cortex and beyond. (C) 2015 Elsevier Ltd. All rights reserved.",CORTEX
WOS:000348378800011,"Bray, S; Arnold, AEGF; Levy, RM; Iaria, G",Spatial and Temporal Functional Connectivity Changes Between Resting and Attentive States,2015,10.1002/hbm.22646,1,31,16,middle,0.322916667,"Remote brain regions show correlated spontaneous activity at rest within well described intrinsic connectivity networks (ICNs). Meta-analytic coactivation studies have uncovered networks similar to resting ICNs, suggesting that in task states connectivity modulations may occur principally within ICNs. However, it has also been suggested that specific hub regions dynamically link networks under different task conditions. Here, we used functional magnetic resonance imaging at rest and a continuous visual attention task in 16 participants to investigate whether a shift from rest to attention was reflected by within-network connectivity modulation, or changes in network topography. Our analyses revealed evidence for both modulation of connectivity within the default-mode (DMN) and dorsal attention networks (DAN) between conditions, and identified a set of regions including the temporoparietal junction (TPJ) and posterior middle frontal gyrus (MFG) that switched between the DMN and DAN depending on the task. We further investigated the temporal nonstationarity of flexible (TPJ and MFG) regions during both attention and rest. This showed that moment-to-moment differences in connectivity at rest mirrored the variation in connectivity between tasks. Task-dependent changes in functional connectivity of flexible regions may, therefore, be understood as shifts in the proportion of time specific connections are engaged, rather than a switch between networks per se. This ability of specific regions to dynamically link ICNs under different task conditions may play an important role in behavioral flexibility. Hum Brain Mapp 36:549-565, 2015. (c) 2014 Wiley Periodicals, Inc.",HUMAN BRAIN MAPPING
WOS:000273626400070,"Beer, JS; Hughes, BL","Neural systems of social comparison and the \above-average\"" effect""",2010,10.1016/j.neuroimage.2009.10.075,1,69,20,middle,0.313636364,"Extant neural models of self-evaluation are dominated by associations with medial prefrontal cortex (MPFC) and posterior cingulate cortex (PCC) function and have mostly been developed from studies differentiating self-evaluation from evaluation of other people. Although self-evaluation is robustly characterized by systematic biases. current neural models of self-evaluation cannot speak to their neurobiology because of a lack of research. The few extant studies have made claims about associations between bias and ventral anterior cingulate cortex (vACC) function but have confounded bias with the valence of experimental stimuli. In study 1, fMRI was used to examine the neurobiology of the ""above-average"" effect. a robust self-evaluation bias The majority of people judge their personality to be more desirable (i e. more positive and less negative traits) than their peers' personalities MPFC and PCC were significantly more activated by a condition that reduced susceptibility to ""above-average"" judgments However, MPFC and PFCC activity were not modulated by individual differences in ""above-average"" judgments VACC activity distinguished positive from negative valence but did not predict individual differences in ""above-average"" judgments Instead, the extent to which participants viewed themselves as ""above average"" was negatively correlated with orbitofrontal cortex (OFC) and, to a lesser extent, dorsal anterior cingulate cortex (dACC) activation A complementary study found that mental load increases ""above-average"" judgments (study 2) These findings are the first to directly examine the neural systems involved in social judgment bias and have implications for the association between frontal lobe dysfunction and poor insight. (C) 2009 Elsevier Inc All rights reserved",NEUROIMAGE
WOS:000291624100006,"Schippers, MB; Keysers, C",Mapping the flow of information within the putative mirror neuron system during gesture observation,2011,10.1016/j.neuroimage.2011.02.018,1,62,18,middle,0.344444444,"The putative mirror neuron system may either function as a strict feed-forward system or as a dynamic control system. A strict feed-forward system would predict that action observation leads to a predominantly temporal -> parietal -> premotor flow of information in which a visual representation is transformed into motor-programs which contribute to action understanding. Instead, a dynamic feedback control system would predict that the reverse direction of information flow predominates because of a combination of inhibitory forward and excitatory inverse models. Here we test which of these conflicting predictions best matches the information flow within the putative mirror neuron system (pMNS) and between the pMNS and the rest of the brain during the observation of comparatively long naturalistic stretches of communicative gestures. We used Granger causality to test the dominant direction of influence. Our results fit the predictions of the dynamic feedback control system: we found predominantly an information flow within the pMNS from premotor to parietal and middle temporal cortices. This is more pronounced during an active guessing task than while passively reviewing the same gestures. In particular, the ventral premotor cortex sends significantly more information to other pMNS areas than it receives during active guessing than during passive observation. (C) 2011 Elsevier Inc. All rights reserved.",NEUROIMAGE
WOS:000293950300027,"Wang, Y; Ramsey, R; Hamilton, AFD",The Control of Mimicry by Eye Contact Is Mediated by Medial Prefrontal Cortex,2011,10.1523/JNEUROSCI.0845-11.2011,1,89,20,middle,0.445,"Spontaneous mimicry of other people's actions serves an important social function, enhancing affiliation and social interaction. This mimicry can be subtly modulated by different social contexts. We recently found behavioral evidence that direct eye gaze rapidly and specifically enhances mimicry of intransitive hand movements (Wang et al., 2011). Based on past findings linking medial prefrontal cortex (mPFC) to both eye contact and the control of mimicry, we hypothesized that mPFC might be the neural origin of this behavioral effect. The present study aimed to test this hypothesis. During functional magnetic resonance imaging (fMRI) scanning, 20 human participants performed a simple mimicry or no-mimicry task, as previously described (Wang et al., 2011), with direct gaze present on half of the trials. As predicted, fMRI results showed that performing the task activated mirror systems, while direct gaze and inhibition of the natural tendency to mimic both engaged mPFC. Critically, we found an interaction between mimicry and eye contact in mPFC, superior temporal sulcus (STS) and inferior frontal gyrus. We then used dynamic causal modeling to contrast 12 possible models of information processing in this network. Results supported a model in which eye contact controls mimicry by modulating the connection strength from mPFC to STS. This suggests that mPFC is the originator of the gaze-mimicry interaction and that it modulates sensory input to the mirror system. Thus, our results demonstrate how different components of the social brain work together to on-line control mimicry according to the social context.",JOURNAL OF NEUROSCIENCE
WOS:000327449000023,"Bruffaerts, R; Dupont, P; Peeters, R; De Deyne, S; Storms, G; Vandenberghe, R",Similarity of fMRI Activity Patterns in Left Perirhinal Cortex Reflects Semantic Similarity between Words,2013,10.1523/JNEUROSCI.1548-13.2013,1,57,19,middle,0.375,"Howverbal and nonverbal visuoperceptual input connects to semantic knowledge is a core question in visual and cognitive neuroscience, with significant clinical ramifications. In an event-related functional magnetic resonance imaging (fMRI) experiment we determined how cosine similarity between fMRI response patterns to concrete words and pictures reflects semantic clustering and semantic distances between the represented entities within a single category. Semantic clustering and semantic distances between 24 animate entities were derived from a concept-feature matrix based on feature generation by >1000 subjects. In the main fMRI study, 19 human subjects performed a property verification task with written words and pictures and a low-level control task. The univariate contrast between the semantic and the control task yielded extensive bilateral occipitotemporal activation from posterior cingulate to anteromedial temporal cortex. Entities belonging to a same semantic cluster elicited more similar fMRI activity patterns in left occipitotemporal cortex. When words and pictures were analyzed separately, the effect reached significance only for words. The semantic similarity effect for words was localized to left perirhinal cortex. According to a representational similarity analysis of left perirhinal responses, semantic distances between entities correlated inversely with cosine similarities between fMRI response patterns to written words. An independent replication study in 16 novel subjects confirmed these novel findings. Semantic similarity is reflected by similarity of functional topography at a fine-grained level in left perirhinal cortex. The word specificity excludes perceptually driven confounds as an explanation and is likely to be task dependent.",JOURNAL OF NEUROSCIENCE
WOS:000321163700006,"Klimecki, OM; Leiberg, S; Lamm, C; Singer, T",Functional Neural Plasticity and Associated Changes in Positive Affect After Compassion Training,2013,10.1093/cercor/bhs142,2,222,91,middle,0.304945055,"The development of social emotions such as compassion is crucial for successful social interactions as well as for the maintenance of mental and physical health, especially when confronted with distressing life events. Yet, the neural mechanisms supporting the training of these emotions are poorly understood. To study affective plasticity in healthy adults, we measured functional neural and subjective responses to witnessing the distress of others in a newly developed task (Socio-affective Video Task). Participants' initial empathic responses to the task were accompanied by negative affect and activations in the anterior insula and anterior medial cingulate cortex-a core neural network underlying empathy for pain. Whereas participants reacted with negative affect before training, compassion training increased positive affective experiences, even in response to witnessing others in distress. On the neural level, we observed that, compared with a memory control group, compassion training elicited activity in a neural network including the medial orbitofrontal cortex, putamen, pallidum, and ventral tegmental area-brain regions previously associated with positive affect and affiliation. Taken together, these findings suggest that the deliberate cultivation of compassion offers a new coping strategy that fosters positive affect even when confronted with the distress of others.",CEREBRAL CORTEX
WOS:000375130500008,"Tusche, A; Bockler, A; Kanske, P; Trautwein, FM; Singer, T","Decoding the Charitable Brain: Empathy, Perspective Taking, and Attention Shifts Differentially Predict Altruistic Giving",2016,10.1523/JNEUROSCI.3392-15.2016,1,70,33,middle,0.424242424,"Altruistic behavior varies considerably across people and decision contexts. The relevant computational and motivational mechanisms that underlie its heterogeneity, however, are poorly understood. Using a charitable giving task together with multivariate decoding techniques, we identified three distinct psychological mechanisms underlying altruistic decision-making (empathy, perspective taking, and attentional reorienting) and linked them to dissociable neural computations. Neural responses in the anterior insula (AI) (but not temporoparietal junction [TPJ]) encoded trial-wise empathy for beneficiaries, whereas the TPJ (but not AI) predicted the degree of perspective taking. Importantly, the relative influence of both socio-cognitive processes differed across individuals: participants whose donation behavior was heavily influenced by affective empathy exhibited higher predictive accuracies for generosity in AI, whereas those who strongly relied on cognitive perspective taking showed improved predictions of generous donations in TPJ. Furthermore, subject-specific contributions of both processes for donations were reflected in participants' empathy and perspective taking responses in a separate fMRI task (EmpaToM), suggesting that process-specific inputs into altruistic choices may reflect participants' general propensity to either empathize or mentalize. Finally, using independent attention task data, we identified shared neural codes for attentional reorienting and generous donations in the posterior superior temporal sulcus, suggesting that domain-general attention shifts also contribute to generous behavior (but not in TPJ or AI). Overall, our findings demonstrate highly specific roles of AI for affective empathy and TPJ for cognitive perspective taking as precursors of prosocial behavior and suggest that these discrete routes of social cognition differentially drive intraindividual and interindividual differences in altruistic behavior.",JOURNAL OF NEUROSCIENCE
WOS:000295970300009,"Hollmann, M; Rieger, JW; Baecke, S; Lutzkendorf, R; Muller, C; Adolf, D; Bernarding, J",Predicting Decisions in Human Social Interactions Using Real-Time fMRI and Pattern Classification,2011,10.1371/journal.pone.0025304,1,26,7,middle,0.371428571,"Negotiation and trade typically require a mutual interaction while simultaneously resting in uncertainty which decision the partner ultimately will make at the end of the process. Assessing already during the negotiation in which direction one's counterpart tends would provide a tremendous advantage. Recently, neuroimaging techniques combined with multivariate pattern classification of the acquired data have made it possible to discriminate subjective states of mind on the basis of their neuronal activation signature. However, to enable an online-assessment of the participant's mind state both approaches need to be extended to a real-time technique. By combining real-time functional magnetic resonance imaging (fMRI) and online pattern classification techniques, we show that it is possible to predict human behavior during social interaction before the interacting partner communicates a specific decision. Average accuracy reached approximately 70% when we predicted online the decisions of volunteers playing the ultimatum game, a well-known paradigm in economic game theory. Our results demonstrate the successful online analysis of complex emotional and cognitive states using real-time fMRI, which will enable a major breakthrough for social fMRI by providing information about mental states of partners already during the mutual interaction. Interestingly, an additional whole brain classification across subjects confirmed the online results: anterior insula, ventral striatum, and lateral orbitofrontal cortex, known to act in emotional self-regulation and reward processing for adjustment of behavior, appeared to be strong determinants of later overt behavior in the ultimatum game. Using whole brain classification we were also able to discriminate between brain processes related to subjective emotional and motivational states and brain processes related to the evaluation of objective financial incentives.",PLOS ONE
WOS:000292717900004,"Sebastian, CL; Tan, GCY; Roiser, JP; Viding, E; Dumontheil, I; Blakemore, SJ",Developmental influences on the neural bases of responses to social rejection: Implications of social neuroscience for education,2011,10.1016/j.neuroimage.2010.09.063,1,115,35,middle,0.328571429,"Relational aggression such as social rejection is common within school peer groups. Converging evidence suggests that adolescent females are particularly sensitive to social rejection. We used a novel fMRI adaptation of the Cyberball social rejection paradigm to investigate the neural response to social rejection in 19 mid-adolescent (aged 14-16) and 16 adult female participants. Across all participants, social exclusion (relative to inclusion) elicited a response in bilateral medial prefrontal cortex (mPFC) extending into ventral and subgenual anterior cingulate cortex and medial orbitofrontal cortex; and the left ventrolateral PFC (vIPFC); regions that have been associated in previous studies with social evaluation, negative affective processing, and affect regulation respectively. However, the exclusion-related response in right vIPFC, a region associated in previous studies with the regulation of rejection-related distress, was attenuated in adolescents. Within mPFC, greater activation during exclusion vs. inclusion was associated with greater self-reported susceptibility to peer influence in adolescents but not in adults. This suggests that the brain's response to experimentally-induced social rejection relates to adolescent behaviour in real-world social interactions. We speculate about the potential implications of these findings for educational settings. In particular, functional development of affective circuitry during adolescence may influence social interaction within the school peer group. (c) 2010 Elsevier Inc. All rights reserved.",NEUROIMAGE
WOS:000416509800017,"Suzuki, S; Cross, L; O'Doherty, JP",Elucidating the underlying components of food valuation in the human orbitofrontal cortex,2017,10.1038/s41593-017-0008-x,1,35,23,middle,0.380434783,"The valuation of food is a fundamental component of our decision-making. Yet little is known about how value signals for food and other rewards are constructed by the brain. Using a food-based decision task in human participants, we found that subjective values can be predicted from beliefs about constituent nutritive attributes of food: protein, fat, carbohydrates and vitamin content. Multivariate analyses of functional MRI data demonstrated that, while food value is represented in patterns of neural activity in both medial and lateral parts of the orbitofrontal cortex (OFC), only the lateral OFC represents the elemental nutritive attributes. Effective connectivity analyses further indicate that information about the nutritive attributes represented in the lateral OFC is integrated within the medial OFC to compute an overall value. These findings provide a mechanistic account for the construction of food value from its constituent nutrients.",NATURE NEUROSCIENCE
WOS:000263232800003,"Northoff, G; Schneider, F; Rotte, M; Matthiae, C; Tempelmann, C; Wiebking, C; Bermpohl, F; Heinzel, A; Danos, P; Heinze, HJ; Bogerts, B; Walter, M; Panksepp, J",Differential Parametric Modulation of Self-Relatedness and Emotions in Different Brain Regions,2009,10.1002/hbm.20510,1,80,15,middle,0.444444444,"Our sense of self is strongly colored by emotions although at the same time we are well able to distinguish affect and self. Using functional magnetic resonance imaging, we here tested for the differential effects of self-relatedness and emotion dimensions (valence, intensity) on parametric modulation of neural activity during perception of emotional stimuli. We observed opposite parametric modulation of self-relatedness and emotion dimensions in the dorsomedial prefrontal cortex and the ventral striatum/nucleus accumbens, whereas neural activity in subcortical regions (tectum, right amygdala, hypothalamus) was modulated by self-relatedness and emotion dimensions in the same direction. In sum, our results demonstrate that self-relatedness is closely linked to emotion dimensions of valence and intensity in many lower subcortical brain regions involved in basic emotional systems and, at the same time, distinct from them in higher cortical regions that mediate cognitive processes necessary for becoming aware of one's self, for example self-consciousness. Hum Brain Mapp 30:369-382, 2009. (C) 2007 Wiley-Liss, Inc.",HUMAN BRAIN MAPPING
WOS:000326953700045,"Cross, KA; Torrisi, S; Losin, EAR; Iacoboni, M",Controlling automatic imitative tendencies: Interactions between mirror neuron and cognitive control systems,2013,10.1016/j.neuroimage.2013.06.060,1,57,17,middle,0.419117647,"Humans have an automatic tendency to imitate others. Although several regions commonly observed in social tasks have been shown to be involved in imitation control, there is little work exploring how these regions interact with one another. We used tMRI and dynamic causal modeling to identify imitation-specific control mechanisms and examine functional interactions between regions. Participants performed a pre-specified action (lifting their index or middle finger) in response to videos depicting the same two actions (biological cues) or dots moving with similar trajectories (non-biological cues). On congruent trials, the stimulus and response were similar (e.g. index finger response to index finger or left side dot stimulus), while on incongruent trials the stimulus and response were dissimilar (e.g. index finger response to middle finger or right side dot stimulus). Reaction times were slower on incongruent compared to congruent trials for both biological and non-biological stimuli, replicating previous findings that suggest the automatic imitative or spatially compatible (congruent) response must be controlled on incongruent trials. Neural correlates of the congruency effects were different depending on the cue type. The medial prefrontal cortex, anterior cingulate, inferior frontal gyrus pars opercularis (IFGpo) and the left anterior insula were involved specifically in controlling imitation. In addition, the IFGpo was also more active for biological compared to non-biological stimuli, suggesting that the region represents the frontal node of the human mirror neuron system (MNS). Effective connectivity analysis exploring the interactions between these regions, suggests a role for the mPFC and ACC in imitative conflict detection and the anterior insula in conflict resolution processes, which may occur through interactions with the frontal node of the MNS. We suggest an extension of the previous models of imitation control involving interactions between imitation-specific and general cognitive control mechanisms. (C) 2013 Elsevier Inc. All rights reserved.",NEUROIMAGE
