UT,AU,TI,PY,DI,study_number,TC_2020,sample_size,RV_dist_location,RV,AB,SO
WOS:000280932400048,"Oosterhof, NN; Wiggett, AJ; Diedrichsen, J; Tipper, SP; Downing, PE",Surface-Based Information Mapping Reveals Crossmodal Vision-Action Representations in Human Parietal and Occipitotemporal Cortex,2010,10.1152/jn.00326.2010,1,130,6,top,1.96969697,"Oosterhof NN, Wiggett AJ, Diedrichsen J, Tipper SP, Downing PE. Surface-based information mapping reveals crossmodal vision-action representations in human parietal and occipitotemporal cortex. J Neurophysiol 104: 1077-1089, 2010. First published June 10, 2010; doi: 10.1152/jn.00326.2010. Many lines of evidence point to a tight linkage between the perceptual and motoric representations of actions. Numerous demonstrations show how the visual perception of an action engages compatible activity in the observer's motor system. This is seen for both intransitive actions (e. g., in the case of unconscious postural imitation) and transitive actions (e. g., grasping an object). Although the discovery of ""mirror neurons"" in macaques has inspired explanations of these processes in human action behaviors, the evidence for areas in the human brain that similarly form a crossmodal visual/motor representation of actions remains incomplete. To address this, in the present study, participants performed and observed hand actions while being scanned with functional MRI. We took a data-driven approach by applying whole-brain information mapping using a multivoxel pattern analysis (MVPA) classifier, performed on reconstructed representations of the cortical surface. The aim was to identify regions in which local voxelwise patterns of activity can distinguish among different actions, across the visual and motor domains. Experiment 1 tested intransitive, meaningless hand movements, whereas experiment 2 tested object-directed actions (all right-handed). Our analyses of both experiments revealed crossmodal action regions in the lateral occipitotemporal cortex (bilaterally) and in the left postcentral gyrus/anterior parietal cortex. Furthermore, in experiment 2 we identified a gradient of bias in the patterns of information in the left hemisphere postcentral/parietal region. The postcentral gyrus carried more information about the effectors used to carry out the action (fingers vs. whole hand), whereas anterior parietal regions carried more information about the goal of the action (lift vs. punch). Taken together, these results provide evidence for common neural coding in these areas of the visual and motor aspects of actions, and demonstrate further how MVPA can contribute to our understanding of the nature of distributed neural representations.",JOURNAL OF NEUROPHYSIOLOGY
WOS:000298485500002,"Dimoka, A; Pavlou, PA; Davis, FD",NeuroIS: The Potential of Cognitive Neuroscience for Information Systems Research,2011,10.1287/isre.1100.0284,1,103,6,top,1.716666667,"This paper introduces the idea of drawing upon the cognitive neuroscience literature to inform IS research (herein termed ""NeuroIS""). Recent advances in cognitive neuroscience are uncovering the neural bases of cognitive, emotional, and social processes, and they offer new insights into the complex interplay between IT and information processing, decision making, and behavior among people, organizations, and markets. The paper reviews the emerging cognitive neuroscience literature to propose a set of seven opportunities that IS researchers can use to inform IS phenomena, namely (1) localizing the neural correlates of IS constructs, (2) capturing hidden mental processes, (3) complementing existing sources of IS data with brain data, (4) identifying antecedents of IS constructs, (5) testing consequences of IS constructs, (6) inferring the temporal ordering among IS constructs, and (7) challenging assumptions and enhancing IS theories. The paper proposes a framework for exploring the potential of cognitive neuroscience for IS research and offers examples of potentially fertile intersections of cognitive neuroscience and IS research in the domains of design science and human-computer interaction. This is followed by an example NeuroIS study in the context of e-commerce adoption using fMRI, which spawns interesting new insights. The challenges of using functional neuroimaging tools are also discussed. The paper concludes that there is considerable potential for using cognitive neuroscience theories and functional brain imaging tools in IS research to enhance IS theories.",INFORMATION SYSTEMS RESEARCH
WOS:000305859300047,"Zaki, J; Davis, JI; Ochsner, KN",Overlapping activity in anterior insula during interoception and emotional experience,2012,10.1016/j.neuroimage.2012.05.012,1,207,16,top,1.4375,"Classic theories of emotion posit that awareness of one's internal bodily states (interoception) is a key component of emotional experience. This view has been indirectly supported by data demonstrating similar patterns of brain activity - most importantly, in the anterior insula - during both interoception and emotion elicitation. However, no study has directly compared these two phenomena within participants, leaving it unclear whether interoception and emotional experience truly share the same functional neural architecture. The current study addressed this gap in knowledge by examining the neural convergence of these two phenomena within the same population. In one task, participants monitored their own heartbeat: in another task they watched emotional video clips and rated their own emotional responses to the videos. Consistent with prior research, heartbeat monitoring engaged a circumscribed area spanning insular cortex and adjacent inferior frontal operculum. Critically, this interoception-related cluster also was engaged when participants rated their own emotion, and activity here correlated with the trial-by-trial intensity of participants' emotional experience. These findings held across both group-level and individual participant-level approaches to localizing interoceptive cortex. Together, these data further clarify the functional role of the anterior insula and provide novel insights about the connection between bodily awareness and emotion. (C) 2012 Elsevier Inc. All rights reserved.",NEUROIMAGE
WOS:000263581900006,"Robins, DL; Hunyadi, E; Schultz, RT",Superior temporal activation in response to dynamic audio-visual emotional cues,2009,10.1016/j.bandc.2008.08.007,2,84,5,top,1.4,"Perception of emotion is critical for successful social interaction, yet the neural mechanisms underlying the perception of dynamic, audio-visual emotional cues are poorly understood. Evidence from language and sensory paradigms suggests that the superior temporal sulcus and gyrus (STS/STG) play a key role in the integration of auditory and visual cues. Emotion perception research has focused on static facial cues; however, dynamic audio-visual (AV) cues mimic real-world social cues more accurately than static and/or unimodal stimuli. Novel dynamic AV stimuli were presented using a block design in two fMRI studies, comparing bimodal stimuli to unimodal conditions, and emotional to neutral stimuli. Results suggest that the bilateral superior temporal region plays distinct roles in the perception of emotion and in the integration of auditory and visual cues. Given the greater ecological validity of the stimuli developed for this study, this paradigm may be helpful in elucidating the deficits in emotion perception experienced by clinical populations. (C) 2008 Elsevier Inc. All rights reserved.",BRAIN AND COGNITION
WOS:000437165800013,"Dugue, L; Merriam, EP; Heeger, DJ; Carrasco, M",Specific Visual Subregions of TPJ Mediate Reorienting of Spatial Attention,2018,10.1093/cercor/bhx140,1,21,5,top,1.4,"The temporo-parietal junction (TPJ) has been associated with various cognitive and social functions, and is critical for attentional reorienting. Attention affects early visual processing. Neuroimaging studies dealing with such processes have thus far concentrated on striate and extrastriate areas. Here, we investigated whether attention orienting or reorienting modulate activity in visually driven TPJ subregions. For each observer we identified 3 visually responsive subregions within TPJ: 2 bilateral (vTPJ(ant) and vTPJ(post)) and 1 right lateralized (vTPJ(cent)). Cortical activity in these subregions was measured using fMRI while observers performed a 2-alternative forced-choice orientation discrimination task. Covert spatial endogenous (voluntary) or exogenous (involuntary) attention was manipulated using either a central or a peripheral cue with task, stimuli and observers constant. Both endogenous and exogenous attention increased activity for invalidly cued trials in right vTPJ(post); only endogenous attention increased activity for invalidly cued trials in left vTPJ(post) and in right vTPJ(cent); and neither type of attention modulated either right or left vTPJ(ant). These results demonstrate that vTPJ(post) and vTPJ(cent) mediate the reorientation of covert attention to task relevant stimuli, thus playing a critical role in visual attention. These findings reveal a differential reorienting cortical response after observers' attention has been oriented to a given location voluntarily or involuntarily.",CEREBRAL CORTEX
WOS:000262301500012,"Meunier, D; Achard, S; Morcom, A; Bullmore, ET",Age-related changes in modular organization of human brain functional networks,2009,10.1016/j.neuroimage.2008.09.062,1,487,30,top,1.352777778,"Graph theory allows us to quantify any complex system, e.g., in social sciences, biology or technology, that can be abstractly described as a set of nodes and links. Here we derived human brain functional networks from fMRI measurements of endogenous, low frequency, correlated oscillations in 90 cortical and subcortical regions for two groups of healthy (young and older) participants. We investigated the modular structure of these networks and tested the hypothesis that normal brain aging might be associated with changes in modularity of sparse networks. Newman's modularity metric was maximised and topological roles were assigned to brain regions depending on their specific contributions to intra-and inter-modular connectivity. Both young and older brain networks demonstrated significantly non-random modularity. The young brain network was decomposed into 3 major modules: central and posterior modules, which comprised mainly nodes with few inter-modular connections, and a dorsal fronto-cingulo-parietal module, which comprised mainly nodes with extensive inter-modular connections. The mean network in the older group also included posterior, superior central and dorsal fronto-striato-thalamic modules but the number of intermodular connections to frontal modular regions was significantly reduced, whereas the number of connector nodes in posterior and central modules was increased. Crown Copyright (C) 2008 Published by Elsevier Inc. All rights reserved.",NEUROIMAGE
WOS:000322361200050,"Kassam, KS; Markey, AR; Cherkassky, VL; Loewenstein, G; Just, MA",Identifying Emotions on the Basis of Neural Activation,2013,10.1371/journal.pone.0066032,1,97,10,top,1.2125,"We attempt to determine the discriminability and organization of neural activation corresponding to the experience of specific emotions. Method actors were asked to self-induce nine emotional states (anger, disgust, envy, fear, happiness, lust, pride, sadness, and shame) while in an fMRI scanner. Using a Gaussian Naive Bayes pooled variance classifier, we demonstrate the ability to identify specific emotions experienced by an individual at well over chance accuracy on the basis of: 1) neural activation of the same individual in other trials, 2) neural activation of other individuals who experienced similar trials, and 3) neural activation of the same individual to a qualitatively different type of emotion induction. Factor analysis identified valence, arousal, sociality, and lust as dimensions underlying the activation patterns. These results suggest a structure for neural representations of emotion and inform theories of emotional processing.",PLOS ONE
WOS:000280503500019,"Peelen, MV; Atkinson, AP; Vuilleumier, P",Supramodal Representations of Perceived Emotions in the Human Brain,2010,10.1523/JNEUROSCI.2161-10.2010,1,235,18,top,1.186868687,"Basic emotional states (such as anger, fear, and joy) can be similarly conveyed by the face, the body, and the voice. Are there human brain regions that represent these emotional mental states regardless of the sensory cues from which they are perceived? To address this question, in the present study participants evaluated the intensity of emotions perceived from face movements, body movements, or vocal intonations, while their brain activity was measured with functional magnetic resonance imaging (fMRI). Using multivoxel pattern analysis, we compared the similarity of response patterns across modalities to test for brain regions in which emotion-specific patterns in one modality (e. g., faces) could predict emotion-specific patterns in another modality (e. g., bodies). A whole-brain searchlight analysis revealed modality-independent but emotion category-specific activity patterns in medial prefrontal cortex (MPFC) and left superior temporal sulcus (STS). Multivoxel patterns in these regions contained information about the category of the perceived emotions (anger, disgust, fear, happiness, sadness) across all modality comparisons (face-body, face-voice, body-voice), and independently of the perceived intensity of the emotions. No systematic emotion-related differences were observed in the overall amplitude of activation in MPFC or STS. These results reveal supramodal representations of emotions in high-level brain areas previously implicated in affective processing, mental state attribution, and theory-of-mind. We suggest that MPFC and STS represent perceived emotions at an abstract, modality-independent level, and thus play a key role in the understanding and categorization of others' emotional mental states.",JOURNAL OF NEUROSCIENCE
WOS:000304445800031,"Tamir, DI; Mitchell, JP",Disclosing information about the self is intrinsically rewarding,2012,10.1073/pnas.1202129109,4,180,17,top,1.176470588,"Humans devote 30-40% of speech output solely to informing others of their own subjective experiences. What drives this propensity for disclosure? Here, we test recent theories that individuals place high subjective value on opportunities to communicate their thoughts and feelings to others and that doing so engages neural and cognitive mechanisms associated with reward. Five studies provided support for this hypothesis. Self-disclosure was strongly associated with increased activation in brain regions that form the mesolimbic dopamine system, including the nucleus accumbens and ventral tegmental area. Moreover, individuals were willing to forgo money to disclose about the self. Two additional studies demonstrated that these effects stemmed from the independent value that individuals placed on self-referential thought and on simply sharing information with others. Together, these findings suggest that the human tendency to convey information about personal experience may arise from the intrinsic value associated with self-disclosure.",PROCEEDINGS OF THE NATIONAL ACADEMY OF SCIENCES OF THE UNITED STATES OF AMERICA
WOS:000263295400043,"Takahashi, H; Kato, M; Matsuura, M; Mobbs, D; Suhara, T; Okubo, Y",When Your Gain Is My Pain and Your Pain Is My Gain: Neural Correlates of Envy and Schadenfreude,2009,10.1126/science.1165604,1,268,19,top,1.175438596,"We often evaluate the self and others from social comparisons. We feel envy when the target person has superior and self- relevant characteristics. Schadenfreude occurs when envied persons fall from grace. To elucidate the neurocognitive mechanisms of envy and schadenfreude, we conducted two functional magnetic resonance imaging studies. In study one, the participants read information concerning target persons characterized by levels of possession and self- relevance of comparison domains. When the target person's possession was superior and self- relevant, stronger envy and stronger anterior cingulate cortex ( ACC) activation were induced. In study two, stronger schadenfreude and stronger striatum activation were induced when misfortunes happened to envied persons. ACC activation in study one predicted ventral striatum activation in study two. Our findings document mechanisms of painful emotion, envy, and a rewarding reaction, schadenfreude.",SCIENCE
WOS:000265095500017,"den Ouden, HEM; Friston, KJ; Daw, ND; McIntosh, AR; Stephan, KE",A Dual Role for Prediction Error in Associative Learning,2009,10.1093/cercor/bhn161,1,190,14,top,1.130952381,"Confronted with a rich sensory environment, the brain must learn statistical regularities across sensory domains to construct causal models of the world. Here, we used functional magnetic resonance imaging and dynamic causal modeling (DCM) to furnish neurophysiological evidence that statistical associations are learnt, even when task-irrelevant. Subjects performed an audio-visual target-detection task while being exposed to distractor stimuli. Unknown to them, auditory distractors predicted the presence or absence of subsequent visual distractors. We modeled incidental learning of these associations using a Rescorla-Wagner (RW) model. Activity in primary visual cortex and putamen reflected learning-dependent surprise: these areas responded progressively more to unpredicted, and progressively less to predicted visual stimuli. Critically, this prediction-error response was observed even when the absence of a visual stimulus was surprising. We investigated the underlying mechanism by embedding the RW model into a DCM to show that auditory to visual connectivity changed significantly over time as a function of prediction error. Thus, consistent with predictive coding models of perception, associative learning is mediated by prediction-error dependent changes in connectivity. These results posit a dual role for prediction-error in encoding surprise and driving associative plasticity.",CEREBRAL CORTEX
WOS:000338110900007,"Vigliocco, G; Kousta, ST; Della Rosa, PA; Vinson, DP; Tettamanti, M; Devlin, JT; Cappa, SF",The Neural Representation of Abstract Words: The Role of Emotion,2014,10.1093/cercor/bht025,1,157,20,top,1.121428571,"It is generally assumed that abstract concepts are linguistically coded, in line with imaging evidence of greater engagement of the left perisylvian language network for abstract than concrete words (Binder JR, Desai RH, Graves WW, Conant LL. 2009. Where is the semantic system? A critical review and meta-analysis of 120 functional neuroimaging studies. Cerebral Cortex. 19:2767-2796; Wang J, Conder JA, Blitzer DN, Shinkareva SV. 2010. Neural representation of abstract and concrete concepts: A meta-analysis of neuroimaging studies. Hum Brain Map. 31:1459-1468). Recent behavioral work, which used tighter matching of items than previous studies, however, suggests that abstract concepts also entail affective processing to a greater extent than concrete concepts (Kousta S-T, Vigliocco G, Vinson DP, Andrews M, Del Campo E. The representation of abstract words: Why emotion matters. J Exp Psychol Gen. 140:14-34). Here we report a functional magnetic resonance imaging experiment that shows greater engagement of the rostral anterior cingulate cortex, an area associated with emotion processing (e.g., Etkin A, Egner T, Peraza DM, Kandel ER, Hirsch J. 2006. Resolving emotional conflict: A role for the rostral anterior cingulate cortex in modulating activity in the amygdala. Neuron. 52:871), in abstract processing. For abstract words, activation in this area was modulated by the hedonic valence (degree of positive or negative affective association) of our items. A correlation analysis of more than 1,400 English words further showed that abstract words, in general, receive higher ratings for affective associations (both valence and arousal) than concrete words, supporting the view that engagement of emotional processing is generally required for processing abstract words. We argue that these results support embodiment views of semantic representation, according to which, whereas concrete concepts are grounded in our sensory-motor experience, affective experience is crucial in the grounding of abstract concepts.",CEREBRAL CORTEX
WOS:000325080900002,"Bassett, DS; Wymbs, NF; Rombach, MP; Porter, MA; Mucha, PJ; Grafton, ST",Task-Based Core-Periphery Organization of Human Brain Dynamics,2013,10.1371/journal.pcbi.1003171,1,178,20,top,1.1125,"As a person learns a new skill, distinct synapses, brain regions, and circuits are engaged and change over time. In this paper, we develop methods to examine patterns of correlated activity across a large set of brain regions. Our goal is to identify properties that enable robust learning of a motor skill. We measure brain activity during motor sequencing and characterize network properties based on coherent activity between brain regions. Using recently developed algorithms to detect time-evolving communities, we find that the complex reconfiguration patterns of the brain's putative functional modules that control learning can be described parsimoniously by the combined presence of a relatively stiff temporal core that is composed primarily of sensorimotor and visual regions whose connectivity changes little in time and a flexible temporal periphery that is composed primarily of multimodal association regions whose connectivity changes frequently. The separation between temporal core and periphery changes over the course of training and, importantly, is a good predictor of individual differences in learning success. The core of dynamically stiff regions exhibits dense connectivity, which is consistent with notions of core-periphery organization established previously in social networks. Our results demonstrate that core-periphery organization provides an insightful way to understand how putative functional modules are linked. This, in turn, enables the prediction of fundamental human capacities, including the production of complex goal-directed behavior.",PLOS COMPUTATIONAL BIOLOGY
WOS:000377917500044,"Guntupalli, JS; Hanke, M; Halchenko, YO; Connolly, AC; Ramadge, PJ; Haxby, JV",A Model of Representational Spaces in Human Cortex,2016,10.1093/cercor/bhw068,2,54,10,top,1.08,"Current models of the functional architecture of human cortex emphasize areas that capture coarse-scale features of cortical topography but provide no account for population responses that encode information in fine-scale patterns of activity. Here, we present a linear model of shared representational spaces in human cortex that captures fine-scale distinctions among population responses with response-tuning basis functions that are common across brains and models cortical patterns of neural responses with individual-specific topographic basis functions. We derive a common model space for the whole cortex using a new algorithm, searchlight hyperalignment, and complex, dynamic stimuli that provide a broad sampling of visual, auditory, and social percepts. The model aligns representations across brains in occipital, temporal, parietal, and prefrontal cortices, as shown by between-subject multivariate pattern classification and intersubject correlation of representational geometry, indicating that structural principles for shared neural representations apply across widely divergent domains of information. The model provides a rigorous account for individual variability of well-known coarse-scale topographies, such as retinotopy and category selectivity, and goes further to account for fine-scale patterns that are multiplexed with coarse-scale topographies and carry finer distinctions.",CEREBRAL CORTEX
WOS:000294708900003,"Cikara, M; Botvinick, MM; Fiske, ST",Us Versus Them: Social Identity Shapes Neural Responses to Intergroup Competition and Harm,2011,10.1177/0956797610397667,1,180,17,top,1.058823529,"Intergroup competition makes social identity salient, which in turn affects how people respond to competitors' hardships. The failures of an in-group member are painful, whereas those of a rival out-group member may give pleasure-a feeling that may motivate harming rivals. The present study examined whether valuation-related neural responses to rival groups' failures correlate with likelihood of harming individuals associated with those rivals. Avid fans of the Red Sox and Yankees teams viewed baseball plays while undergoing functional magnetic resonance imaging. Subjectively negative outcomes (failure of the favored team or success of the rival team) activated anterior cingulate cortex and insula, whereas positive outcomes (success of the favored team or failure of the rival team, even against a third team) activated ventral striatum. The ventral striatum effect, associated with subjective pleasure, also correlated with self-reported likelihood of aggressing against a fan of the rival team (controlling for general aggression). Outcomes of social group competition can directly affect primary reward-processing neural systems, which has implications for intergroup harm.",PSYCHOLOGICAL SCIENCE
